{
	"asset": {
		"referenceFilename": "myh_abc123_v01_pm.wav",
		"fileRole": "pm",
		"schemaVersion": "1.1.0"
	},
	"bibliographic": {
		"primaryID": "abc123",
		"classmark": "*ABC 123",
		"formerClassmark": "*NCOW 123",
		"nonCMSID": "string123",
		"cmsItemID": "123456",
		"cmsCollectionID": "string123",
		"catalogBNumber": "B12345678",
		"mssID": "12345",
		"barcode": "33433123456789",
		"divisionCode": "myh",
		"vernacularDivisionCode": "DAN",
		"projectCode": "projectXYZ",
		"title": "Dance Audio 1",
		"date": "Late 1970s",
		"contentNotes": "media is actually Dance Audio 2 instead of Dance Audio 1"
	},
	"technical": {
		"filename": "myh_abc123_v01_pm",
		"extension": "wav",
		"dateCreated": "2016-01-01",
		"fileFormat": "BWF",
		"audioCodec": "PCM",
		"fileSize": {
			"measure": 2000000000,
			"unit": "B"
		},
		"durationMilli": {
			"measure": 3600000,
			"unit": "ms"
		},
		"durationHuman": "1:00:00.000",
		"signalNotes": "signal undreadable at point 123"
	},
	"source": {
		"object": {
			"type": "audio reel digital",
			"format": "ProDigi",
			"generation": "unknown",
			"volumeNumber": 1
		},
		"subObject": {
			"faceNumber": 1,
			"regionNumber": 2,
			"streamNumber": 1,
			"partNumber": 1
		},
		"physicalDescription": {
			"diameter": {
				"measure": 7,
				"unit": "in"
			},
			"stockManufacturer": "Manufacturer A",
			"stockProductID": "idabc123",
			"tapeWidth": {
				"measure": 0.25,
				"unit": "in"
			},
			"tapeThickness": {
				"measure": 1.5,
				"unit": "mils"
			},
			"baseMaterial": "polyester",
			"backcoatMaterial": "yes"
		},
		"audioRecording": {
			"audioSoundField": "multitrack",
			"numberOfAudioTracks": 48,
			"designatedSpeed": {
				"measure": 3.75,
				"unit": "ips"
			},
			"audioBitDepth": {
				"measure": 24,
				"unit": "bit"
			},
			"audioSamplingRate": {
				"measure": 22500,
				"unit": "hz"
			}
		},
		"notes": {
			"physicalConditionPreShipNotes": "reel show XYZ damage",
			"physicalConditionDigitizationNotes": "tape shows XYZ damage"
		}
	},
	"digitizationProcess": {
		"playbackDevice": {
			"serialNumber": "xyz123",
			"manufacturer": "Manufacturer B",
			"model": "Model XYZ",
			"speed": {
				"measure": 7.5,
				"unit": "ips"
			}
		},
		"captureSoftware": {
			"manufacturer": "Manufacturer E",
			"productName": "Product XYZ",
			"version": "Version 123",
			"platform": "OS XYZ"
		},
		"notes": {
			"processNotes": "required intervention for reason xyz"
		}
	},
	"digitizer": {
		"operator": {
			"firstName": "Doe",
			"lastName": "Jane"
		},
		"organization": {
			"name": "Organization XYZ",
      "address": {
        "street1": "123 ABC St",
        "street2": "Suite 1234",
        "city":    "Anytown",
        "state":   "ST",
        "postalCode": "12345"
      }
		}
	}
}
